	section	paragraph	sentence	text
1	Title	1	1	Controlling motor neurons of every muscle for fly proboscis reaching
2	Abstract	1	1	We describe the anatomy of all the primary motor neurons in the fly proboscis and characterize their contributions to its diverse reaching movements.
3	Abstract	1	2	Pairing this behavior with the wealth of Drosophila’s genetic tools offers the possibility to study motor control at single-neuron resolution, and soon throughout entire circuits.
4	Abstract	1	3	As an entry to these circuits, we provide detailed anatomy of proboscis motor neurons, muscles, and joints.
5	Abstract	1	4	We create a collection of fly strains to individually manipulate every proboscis muscle through control of its motor neurons, the first such collection for an appendage.
6	Abstract	1	5	We generate a model of the action of each proboscis joint, and find that only a small number of motor neurons are needed to produce proboscis reaching.
7	Abstract	1	6	Comprehensive control of each motor element in this numerically simple system paves the way for future study of both reflexive and flexible movements of this appendage.
8	[Introduction]	1	1	Thank you for submitting your article "Comprehensive genetic tools to target motor neurons for each muscle of the fly proboscis" for consideration by eLife.
9	[Introduction]	1	2	Your article has been reviewed by three peer reviewers, including Ronald Calabrese as the Reviewing Editor, Senior Editor and Reviewer #2.
10	[Introduction]	2	1	The reviewers have discussed the reviews with one another and the Reviewing Editor has drafted this decision to help you prepare a revised submission.
11	[Introduction]	3	1	Summary:
12	[Introduction]	4	1	This is a co-submission of two papers.
13	[Introduction]	4	2	The goal of the first work is achieving genetic control over motor neurons for every muscle of the Drosophila proboscis, and it is accomplished convincingly.
14	[Introduction]	4	3	The degree of success constructing split Gal4 lines that label only a single bilateral pair of motor neuron corresponding to each muscle of the proboscis is really remarkable, and there is no doubt that these tools will be of tremendous use in defining the neuronal networks responsible for reaching movements of the proboscis and indeed the sucking movements also.
15	[Introduction]	4	4	The anatomical data presented is beautiful.
16	[Introduction]	4	5	After achieving genetic control over motor neurons for every muscle of the Drosophila proboscis, the authors in the second work systematically test every motor neuron that inserts on cuticle (including apodemes) and is thus likely to move the proboscis (rather than inserting on the pharynx and likely involved in sucking) with activation and inactivation experiments.
17	[Introduction]	4	6	By combining kinematics and some biomechanics, the authors arrive at a functional role for each of the proboscis inserting muscle and their motor neurons.
18	[Introduction]	4	7	The data presented is comprehensive and convincing.
19	[Introduction]	4	8	When combined these two papers, very clearly supersede a previous attempt (Schwarz et al., 2017) at such tool development and analysis with several important corrections and many major refinements.
20	[Introduction]	5	1	Essential revisions:
21	[Introduction]	6	1	Upon careful review of these two co-submitted papers (henceforth referred to a Paper 1 and Paper 2) it was the clear consensus of the reviewers that neither paper alone is strong enough for eLife and we would understand if you chose to take the paper(s) elsewhere.
22	[Introduction]	6	2	If on the other hand, you chose to submit the two papers to eLife as one joint paper, then we would ensure that they were sent to the same reviewers, and we think that there is a high chance of publication with a short turn-around.
23	[Introduction]	6	3	No new experiments or analyses are needed.
24	[Introduction]	7	1	If you take the eLife route the papers should be combined and focused.
25	[Introduction]	7	2	One paper will be easier for the authors to present and for the reader to comprehend.
26	[Introduction]	7	3	One could not read the Paper 2 without constantly referring to Paper 1 and the Paper 2 contains much repetition of the findings of Paper 1.
27	[Introduction]	8	1	There are several ways that the papers can be fitted together as detailed in the individual expert reviews.
28	[Introduction]	9	1	One potential path:
29	[Introduction]	10	1	1) The theme presented for Paper 1 of rhythmic vs. discrete behaviors is not effectively exploited nor can it be given the data presented.
30	[Introduction]	10	2	Likewise, the comparison to human reaching in Paper 2 seems premature and focusing the combined single paper on the tools developed and the wonderful anatomy and first-pass functional analysis seems more fruitful.
31	[Introduction]	10	3	The data Figure 9 Paper 1 seems premature and underdeveloped for publication as does the data of Figure 8 Paper 2.
32	[Introduction]	10	4	They are presented is support of the rhythmic vs. discrete behaviors and human reaching themes and are not compelling.
33	[Introduction]	10	5	We recommend removing these figures to focus the paper.
34	[Introduction]	11	1	2) Efficiency with the figures would help.
35	[Introduction]	11	2	Figure 1 of Paper 2 could benefit from comparison directly to Figure 1 of Paper 1.
36	[Introduction]	11	3	Figure 2 of Paper 1 should be supplementary and fits thematically with Paper 2 material.
37	[Introduction]	11	4	The expert reviews suggest other figure fusions and changes.
38	[Introduction]	12	1	3) The data of Figure 7 Paper 1 is reminiscent of data in Schwarz et al., 2017, albeit with corrections but need not be elaborated and could be perhaps combined with Figure 8 Paper 1, which is somewhat underdeveloped.
39	[Introduction]	13	1	4) Discussions can be shortened and in Paper 2 shifted away from detailed comparison to in Schwarz et al., 2017.
40	[Introduction]	14	1	5) All Essential revisions in the expert reviews should all be addressed.
41	[Introduction]	15	1	Reviewer #1:
42	[Introduction]	16	1	In two related papers, McKellar and colleagues present the results of a screen to genetically label and optogenetically activate each motor neuron that innervates muscles in the proboscis of Drosophila melanogaster.
43	[Introduction]	17	1	In the first manuscript, entitled "Comprehensive genetic tools to target motor neurons for each muscle of the fly proboscis", they present genetic driver lines for each motor neuron together with careful anatomy of cuticular structures and musculature.
44	[Introduction]	17	2	Ten proboscis muscles and their associated motor neurons control the position of proboscis parts and are involved in the proboscis extension response (PER), while the remaining eight muscles control the constriction of the pharynx.
45	[Introduction]	17	3	In the course of this work, the authors identify several new muscles.
46	[Introduction]	18	1	Once the authors develop split-Gal4 genetic labels for each motor neuron, they can drive the expression of CsChrimson to activate, or Tetanus toxin to silence, each motor neuron.
47	[Introduction]	18	2	They present the results of these experiments in a second paper entitled "Motor neuron control of Drosophila proboscis reaching".
48	[Introduction]	18	3	The main advances of this work are the resulting genetic tools and a more comprehensive knowledge of how particular muscles insert onto cuticular structures to extend or flex proboscis parts about joints.
49	[Introduction]	18	4	These advances clarify the results of past investigations similar into motor control of the proboscis (in particular, Schwarz, Motor control of Drosophila feeding behavior).
50	[Introduction]	19	1	Across both papers, the images of motor neuron and musculature anatomy are illustrative and quite beautiful.
51	[Introduction]	19	2	Optogenetic activation of individual motor neurons confirms the role each plays in controlling the proboscis segment.
52	[Introduction]	19	3	Together, these data allow the authors to articulate a model of how motor neuron activation and muscle contraction enables the fly to extend its proboscis.
53	[Introduction]	20	1	Although the tools and data in these papers are detailed and valuable, the papers do not effectively show what new insight has been gained relative to previous studies.
54	[Introduction]	20	2	There is also a large experimental gap: while the authors create the necessary genetic tools, they do not investigate the neural control and natural dynamics of proboscis movement beyond artificial optogenetic stimulation.
55	[Introduction]	20	3	In the absence of such data, the main contribution of these papers is the clear and thorough anatomy.
56	[Introduction]	20	4	However, the convoluted organization of the two manuscripts require the reader to sift through disparate data to reach a clear understanding of how the proboscis motor system is organized.
57	[Introduction]	20	5	These manuscripts would need to be significantly reorganized and streamlined to be understood by a general neuroscience audience.
58	[Introduction]	21	1	Essential revisions:
59	[Introduction]	22	1	1) It is not clear to why these manuscripts are separate.
60	[Introduction]	22	2	The basis for separating them seems to be to avoid one behemoth paper but the division between tools and function obscures the take-home message of the work.
61	[Introduction]	22	3	For example, many of the descriptions of musculature in "Comprehensive genetic tools to target motor neurons for each muscle of the fly proboscis" (called paper 1 below) are critical for understanding the optogenetic activation of motor neurons in "Motor neuron control of Drosophila proboscis reaching" (called paper 2 below), resulting in an unnecessary duplication of effort between the manuscripts to understand how the proboscis is moved.
62	[Introduction]	22	4	Take mn9, for example: it is hard to know what to take from Figure 1, Figure 4 and Figure 9 in paper 1, if the critical proof to show that mn9 extends the proboscis is in paper 2.
63	[Introduction]	22	5	(Past work has shown m9 to be involved in proboscis protraction, so you could argue that a knowledgeable reader may know this, but that undercuts the purpose of Figure 2 in paper 2).
64	[Introduction]	22	6	There are also examples of data in primary figures that do not advance the author's case.
65	[Introduction]	22	7	For example, in paper 1, Figure 2, Figure 3, Figure 6 and Figure 8 are supplementary figures.
66	[Introduction]	22	8	Figure 2: The images of FlyLight Gen 1 Gal4 lines are unhelpful, fly researchers can find these and they are not helpful to a non-Drosophilist.
67	[Introduction]	22	9	Figure 3: I commend the authors for including images of the entire nervous system, not often shown, but again, these are supporting information.
68	[Introduction]	22	10	Figure 6 can support Figure 5.
69	[Introduction]	22	11	Figure 8 does suggest that MNs likely do not receive direct information from sensory neurons or other previously described interneurons, but these hypotheses are not tested further, so Figure 8 can support Figure 7.
70	[Introduction]	23	1	By the same token, paper 2 would benefit from schematics of muscles and an overview of reaching related vs. pharyngeal motor neurons.
71	[Introduction]	23	2	This distinction is helpful, and since it is consistent with past work.
72	[Introduction]	23	3	Because the function of pharyngeal muscles is not explored further, it would not detract from the message of paper 2. paper 2 contains functional data that can be combined: e.g. protraction (Figure 2) and retraction (Figure 3) of the rostrum could be one figure, together with anatomical data from paper 1.
73	[Introduction]	23	4	Figure 2, Figure 3, Figure 4 and Figure 5 also contain many panels of different metrics, normalized or baseline subtracted.
74	[Introduction]	23	5	It is not necessary to show all these data in this form, and it detracts from the message.
75	[Introduction]	23	6	My suggestion would be to combine Figure 2 Figure 3, Figure 4 and Figure 5 haustellum and rostrum images.
76	[Introduction]	23	7	Figure 7 is beautiful!
77	[Introduction]	23	8	But it should be split up to accompany the data in Figure 2 and Figure 3 and Figure 4 and Figure 5.
78	[Introduction]	24	1	In addition, much of the introductions of both manuscripts are either unnecessary or misleading (see below), so combining the data into a single manuscript will also help to eliminate those problems.
79	[Introduction]	24	2	In summary, I do not see a clear reason to split data across papers.
80	[Introduction]	25	1	2) The optogenetic activation data that the authors present do not provide insight into how reaching kinematics are produced: 2 second stimulation of motor neurons is not a naturalistic manipulation, and resulting proboscis trajectories are collapsed into single numbers in Figure 2, Figure 3, Figure 4, Figure 5 and Figure 6 of paper 2.
81	[Introduction]	25	2	Schwarz et al., also concluded that reaching is the result of precise temporal patterns of activation of proboscis motor neurons.
82	[Introduction]	25	3	The authors have all the tools to explore this further with calcium imaging or electrophysiology, though it is understandably beyond the scope of this paper.
83	[Introduction]	25	4	I anticipate another paper that begins with the observations in Figure 8 of paper 2 and then uses the tools shown here to explore how these searching movements are created.
84	[Introduction]	26	1	3) A related aspect of reaching is the treatment of what the authors call "coupling" of distinct parts of the proboscis, as when mn9 is activated and extends the haustellum in addition to the rostrum.
85	[Introduction]	26	2	Is this coupling mechanical, neural, or driven by proprioceptive feedback?
86	[Introduction]	26	3	The activation of additional motor neurons could be ruled out by silencing haustellum extending mns while activating mn9.
87	[Introduction]	26	4	The authors do not discuss sensory feedback, or the role of proprioception in determining the location of the target.
88	[Introduction]	26	5	This would be an interesting direction to pursue to draw closer connections to reaching in other organisms.
89	[Introduction]	27	1	4) The authors state at various times that these genetic tools could help to make neural control of the proboscis a model for (1) rhythmic vs. discrete movements, and (2) a model of reaching in humans.
90	[Introduction]	27	2	These statements appear in the abstract and introductions of both papers, with little scholarship or links to literature that may prime the reader as to functional features that are similar in both models.
91	[Introduction]	27	3	The data to support these assertions are that proboscis speed is a bell shaped curve as a function of time and that proboscis reaching pauses to enter a second phase of slow approach.
92	[Introduction]	27	4	These observations seem rather trivial; what is the alternative?
93	[Introduction]	27	5	As the authors point out, proboscis reaching is already thought to be more complex than simply a reflex.
94	[Introduction]	28	1	Reviewer #2:
95	[Introduction]	29	1	Achieving genetic control over motor neurons for every muscle of the Drosophila proboscis is the laudable goal of this work, and it is accomplished convincingly.
96	[Introduction]	29	2	Surely there are nits to pick over the failure the achieve split Gal4 lines that label only a single bilateral pair of motor neuron corresponding to each muscle of the proboscis, BUT the degree of success is really remarkable, and there is no doubt that these tools will be of tremendous use in defining the neuronal networks responsible for reaching movements of the proboscis and indeed the sucking movements also.
97	[Introduction]	29	3	The anatomical data presented is beautiful.
98	[Introduction]	29	4	When combined with the companion paper (Motor neuron control of Drosophila proboscis reaching) it is very clear that this work supersedes a previous attempt (Schwarz et al., 2017) at such tool development and analysis with several important corrections and many major refinements
99	[Introduction]	30	1	Essential revisions:
100	[Introduction]	31	1	Upon carefully reviewing this paper (henceforth referred to a Paper 1) and its companion by the exact same authors (Motor neuron control of Drosophila proboscis reaching - henceforth referred to as Paper 2), I do not recommend that they be published independently.
101	[Introduction]	31	2	One paper will be easier for the authors to present and for the reader to comprehend.
102	[Introduction]	31	3	I could not read the Paper 2 without constantly referring to Paper 1 and the Paper 2 contains much repetition of the findings of Paper 1.
103	[Introduction]	31	4	The theme presented for Paper 1 of rhythmic vs. discrete behaviors is not effectively exploited nor can it be given the data presented so much of the rationale for an independent paper is lost.
104	[Introduction]	31	5	There are several ways that the papers can be fitted together.
105	[Introduction]	31	6	Efficiency with the figures would help.
106	[Introduction]	31	7	Figure 1 of Paper 2 could benefit from comparison directly to Figure 1 of Paper 1.
107	[Introduction]	31	8	Figure 2 of Paper 1 should be supplementary and fits thematically with Paper 2.
108	[Introduction]	31	9	The VNC confocal projection of Figure 3 Paper 1 are distracting, convey little information useful to the general reader, and can certainly be supplementary.
109	[Introduction]	31	10	The data of Figure 7 Paper 1 is reminiscent of data in Schwarz et al., 2017, albeit with corrections but need not be elaborated and could be perhaps combined with Figure 8 Paper 1 which is somewhat underdeveloped.
110	[Introduction]	31	11	The data Figure 9 Paper 1 seems premature for publication.
111	[Introduction]	32	1	Reviewer #3:
112	[Introduction]	33	1	This work provides tools that target every type of motor neurons in the proboscis, as evidenced by the fact that all muscle types are covered by the domains of neuromuscular junctions.
113	[Introduction]	33	2	Proximity of motor neuron dendrites to other neurons provide hints as to the interaction of sensory and central circuits with the motor neurons.
114	[Introduction]	33	3	These tools can now be used for functional studies, an example of which is provided in the accompanying manuscript.
115	[Introduction]	33	4	I found this to be really nice manuscript that will certainly be very useful for the Drosophila neural circuit community, particularly those working on feeding behavior.
116	[Introduction]	33	5	It really fills a missing dataset, complementing the numerous sensory neuron lines that are available, as well as the increasing number of interneuronal lines that have been used for feeding behavior analysis.
117	[Introduction]	33	6	My comments are not of the major kind, focusing more on presentation style.
118	[Introduction]	34	1	[Editors' note: further revisions were suggested prior to acceptance, as described below.]
119	[Introduction]	35	1	Thank you for resubmitting your article "Controlling every muscle for directed reaching of the fly proboscis" for consideration by eLife.
120	[Introduction]	35	2	Your article has been reviewed by three peer reviewers, including Ronald Calabrese as the Reviewing Editor, Senior Editor and Reviewer #2.
121	[Introduction]	36	1	The reviewers have discussed the reviews with one another and the Reviewing Editor has drafted this decision to help you prepare a revised submission.
122	[Introduction]	37	1	We would like to draw your attention to changes in our revision policy that we have made in response to COVID-19 (https://elifesciences.org/articles/57162).
123	[Introduction]	37	2	Specifically, we are asking editors to accept without delay manuscripts, like yours, that they judge can stand as eLife papers without additional data, even if they feel that they would make the manuscript stronger.
124	[Introduction]	37	3	Thus the revisions requested below only address clarity and presentation.
125	[Introduction]	38	1	Summary:
126	[Introduction]	39	1	This paper presents remarkable anatomy and structure-function analysis of the muscles controlling the proboscis of Drosophila and firmly establishing this as model for the study of directed movements.
127	[Introduction]	39	2	They also perform thorough motor neuron activation (CsChrimson) /silencing (TNT) experiments using highly specific splitGAL4 lines and the lines provide a great set of tools for deeper functional analysis going forward.
128	[Introduction]	40	1	Title: Please consider the changes to the title suggested by reviewer #1.
129	[Introduction]	41	1	Essential revisions:
130	[Introduction]	42	1	The authors have made a very strong revision of the manuscript, responding appropriately to all the reviewer comments.
131	[Introduction]	42	2	In the spirit of make a strong paper even stronger, the reviewers present further revisions, that can be accomplished expeditiously and can be reviewed by the RE.
132	[Introduction]	43	1	Reviewer #1:
133	[Introduction]	44	1	Summary:
134	[Introduction]	45	1	This revised manuscript, in which the authors combined their two previous manuscripts, is much improved.
135	[Introduction]	45	2	I have one point that should be addressed to help improve the clarity and organization of the paper.
136	[Introduction]	46	1	Essential revisions:
137	[Introduction]	47	1	Figure 7 and Figure 8 contain many separate panels that describe the effects of activation and deficits of silencing proboscis motor neurons.
138	[Introduction]	47	2	Even though the y-axis labels contain the information they report, each panel uses different units, which makes it confusing for readers to understand how these values relate to proboscis kinematics.
139	[Introduction]	48	1	In particular, interpreting changes in angle during feeding requires extra mental gymnastics.
140	[Introduction]	48	2	The change in angle from rest to feeding appears to be 80 deg (Figure 7I and Figure 7J).
141	[Introduction]	48	3	Activating mn9 does not further increase the rostrum feeding angle in Figure 7D.
142	[Introduction]	48	4	One might then attempt to compare angles in Figure 7I and Figure 7D, but the authors are thinking about this differently.
143	[Introduction]	48	5	Their logic is that activation (Figure7D) happens after the proboscis is extended, so the change should be about 0, whereas the positive 80 deg change during feeding does not occur when mn9 is silenced.
144	[Introduction]	49	1	I suggest that instead of displaying the change in rostrum and haustellum angle during feeding, the authors should plot rostrum and haustellum angle during feeding.
145	[Introduction]	49	2	The authors should also explain the rationale behind the units in the legend.
146	[Introduction]	49	3	It is possible that chrimson expression in mn9 actually causes a different feeding angle to begin with, which would be interesting.
147	[Introduction]	49	4	If the proboscis was more extended, this would suggest an increase in baseline excitation.
148	[Introduction]	49	5	If it was more flexed and retracted, it could imply compensatory feedback to combat overexcitation.
149	[Introduction]	49	6	Same for mns 1 and 2V.
150	[Introduction]	50	1	Reviewer #3:
151	[Introduction]	51	1	What a gorgeous paper.
152	[Introduction]	51	2	I think it's a wonderful piece of work.
153	[Introduction]	51	3	I only have two very minor comments on the revision:
154	[Introduction]	52	1	1) Subsection “An updated inventory of proboscis muscles” (second paragraph).
155	[Introduction]	52	2	Either a semi-colon or full stop after m3M.
156	[Introduction]	52	3	Also, in the figure legend, define L at the bottom.
157	[Introduction]	53	1	2) In the Abstract, they write "…and throughout entire circuits, as the fly connectome approaches."
158	[Introduction]	53	2	However, there is no mention of this theme in the Discussion section.
159	[Introduction]	53	3	Maybe a sentence or two somewhere in the Discussion section on how their identification of the muscles and the motor neurons might help decipher the meaning of the interneuronal connections that will be revealed in the connectome.
160	[Introduction]	53	4	I personally believe it will be enormously useful, because, as the authors write (Introduction), "…they are the outputs upon which higher order circuits must act."
161	[Introduction]	54	1	Now removed.
162	[Introduction]	55	1	We understand the reservations about the analogy to directed reaching in vertebrates, and have removed the more speculative mention of this idea.
163	[Introduction]	55	2	However, since we do believe this to be an exciting future application of this work, we include it briefly in the Discussion section.
164	[Introduction]	56	1	Done.
165	[Introduction]	57	1	Now reorganised.
166	[Introduction]	58	1	now removed for the sake of streamlining, since it made only a minor point.
167	[Introduction]	59	1	Done.
168	[Introduction]	60	1	We have handled this according to Reviewer 1’s request that the former Figure 8 be a supplement to the former Figure 7 - now Figure 5.
169	[Introduction]	61	1	We have removed the detailed comparison from the text.
170	[Introduction]	61	2	There are differences in the findings that significantly alter interpretation of muscle roles, so wenow provide a supplementary table (newFigure 9 -figure supplement 1) summarizing our findings, and showing with asterisks which are new or different from published work.]
171	[Introduction]	62	1	Done.
172	[Introduction]	63	1	Please see newFigure 9 -figure supplement 1 summarizing that 12 of the 16 behavioral phenotypes we describe were previously unknown.
173	[Introduction]	64	1	While optogenetic activation is artificial, silencing experiments are carried out in flies performing natural behaviors (for example, in Figure 8F-J and Figure 9H-I).
174	[Introduction]	64	2	Controls in these experiments provide measures of natural behavior.
