	tag	label	sentence	text
174	figure	Figure 7	9	In the lamina (to the top and left of the image), Lawf1/2 and L5 neurons and marginal glia are recognizable.
175	figure	Figure 7—figure supplement 1	1	Patterns of neurotransmitter receptor expression complement connectomics.
176	figure	Figure 7—figure supplement 1	2	(A) Transcriptomes reveal the neurotransmitters in core cell types of the ON and OFF components of the motion detection pathway.
177	figure	Figure 7—figure supplement 1	3	The ON and OFF motion detection pathways supply inputs to directionally sensitive T4 and T5 neurons, respectively (Takemura et al., 2017; Shinomiya et al., 2019).
178	figure	Figure 7—figure supplement 1	4	Our results show that all of the inputs to T5 (Tm1, Tm2, Tm4, and Tm9) are cholinergic, whereas the inputs to T4 are a mixture of GABAergic (C3, Mi4), cholinergic (Mi1, Tm3), and glutamatergic (Mi9), suggesting different input signs.
179	figure	Figure 7—figure supplement 1	5	Discovering the functional signs of inputs to the directionally selective neurons is an essential step in understanding the mechanism of this long-studied neuronal computation (Strother et al., 2017).
180	figure	Figure 7—figure supplement 1	6	In addition, our data reveals aspects of the motion pathway that have not yet been functionally examined, such as the identification of other signaling components (see B).
181	figure	Figure 7—figure supplement 1	7	(B) Examples of the expression of genes involved in neuropeptide, non-canonical small molecule (nitric oxide), or gap junction communication in the cell types in (A).
182	figure	Figure 8	1	Molecular and connectomics analyses suggest R8 photoreceptors signal via both histaminergic and cholinergic neurotransmission.
183	figure	Figure 8	2	(A, A’, A’’, B).
184	figure	Figure 8	3	Expression of VAChT in R8 cells.
185	figure	Figure 8	4	Expression of a HA-tagged VAChT was induced in R8 cells by recombinase-mediated excision of an interruption cassette from a modified genomic copy of the VAChT gene (Pankova and Borst, 2017).
186	figure	Figure 8	5	R7 and R8 cells project to different layers of the medulla (A, schematic).
187	figure	Figure 8	6	Single confocal sections show R7 and R8 cells in magenta and anti-HA immunolabeling in green.
188	figure	Figure 8	7	R7 and R8 cells (labeled with mAb 24B10) are shown in magenta.
189	figure	Figure 8	8	Stop-cassette excision in R8 photoreceptors (using sens-FLP) results in VAChT-HA labeling of R8 terminals in both the main medulla (A’) and the dorsal rim (where R7 and R8 cells project to very similar layer positions) (A’’).
190	figure	Figure 8	9	Stop-cassette excision in all photoreceptors (using ey3.5-FLP) also produces VAChT-HA labeling in R8 while expression in R7 was not detected (B).
191	figure	Figure 8	10	Scale bar, 10 µm.
192	figure	Figure 8	11	(C) Heatmap of receptor expression probabilities (color) and relative abundance (numbers; transcripts per million) in R8 targets identified by EM (at least five synapses in Takemura et al., 2013).
193	figure	Figure 8	12	(D) Connectivity network for R8 cells, overlaid with receptor expression.
194	figure	Figure 8	13	(E) Possible distributions of postsynaptic receptors at R8 synapses.
195	figure	Figure 8	14	Individual active zones can interact with multiple postsynaptic cells which could be grouped in distinct ways.
196	figure	Figure 8	15	(F) Classification of postsynaptic cells at individual R8 active zones (Takemura et al., 2013) based on histamine receptor expression.
197	figure	Figure 8	16	(G) Same analysis as in F but for an R7 cell.
198	figure	Figure 9	1	Using gene expression to functionally interpret circuit structure.
199	figure	Figure 9	2	(A) Different properties of GABA-A receptors in Drosophila observed in in vitro studies.
200	figure	Figure 9	3	GABA-A receptor subunits can form either cation or anion channels depending on subunit composition.
201	figure	Figure 9	4	(B) Expression of GABA-A subunits in selected cell types.
202	figure	Figure 9	5	(C) L1 and two of its target cells form strong reciprocal connections with C2 neurons.
203	figure	Figure 9	6	(D) Distribution of Rdl and Grd expressing cells at individual C2 synapses.
204	figure	Figure 9	7	(E) Glutamate receptors can also be excitatory or inhibitory.
205	figure	Figure 9	8	(F) Examples of expression patterns for selected glutamate receptors and transporters.
206	figure	Figure 9	9	(G, H) Morphology of Lai (G) and Dm9 (H) cells.
207	figure	Figure 9	10	Illustrations based on MCFO images of single cells.
208	figure	Figure 9	11	(I, J) Analysis of the input and output pathways of Lai (I) and Dm9 (J) neurons suggests a potentially similar functional role for these cells.
209	figure	Figure 9	12	The predicted absence of GluCl-alpha in Dm9 suggests that glutamatergic input from Dm8 to Dm9 may be excitatory.
210	supplement	Supplementary file 1	1	Supplemental tables (A) All drivers (B) RNAseq samples (C) Benchmark entries (D) Marker genes (E) Anatomy details (F) TAPIN-seq buffers.
211	supplement	Supplementary file 2	1	Key Resource Table.
212	supplement	Supplementary file 2	2	List of key resources and reagents used in this study.
